[
  {
    "situation": {
      "role": "OC",
      "offense": "KC",
      "defense": "BAL",
      "season": 2026,
      "down": 3,
      "distance": 7,
      "yardline_100": 35,
      "quarter": 4,
      "clock_seconds": 130,
      "score_diff": -4,
      "timeouts_offense": 1,
      "timeouts_defense": 2
    },
    "fact_sheet": {
      "fact_sheet_version": "1.1.0",
      "context": {
        "kind": "situation",
        "situation": {
          "role": "OC",
          "offense": "KC",
          "defense": "BAL",
          "season": 2026,
          "down": 3,
          "distance": 7,
          "yardline_100": 35,
          "quarter": 4,
          "clock_seconds": 130,
          "score_diff": -4,
          "timeouts_offense": 1,
          "timeouts_defense": 2
        }
      },
      "derived": {
        "down": 3,
        "dist_bucket": "long",
        "field_zone": "opp_territory",
        "score_state": "trail_1_8",
        "time_bucket": "fourth_quarter"
      },
      "facts": [
        {
          "id": "KC.off.2025.down_dist.d3-long.pass_rate",
          "label": "KC offense: pass rate, 3rd & long (2025)",
          "value": 0.7586,
          "display": "76%",
          "unit": "rate",
          "n": 58,
          "low_sample": false,
          "league_value": 0.6956,
          "league_display": "70%"
        },
        {
          "id": "KC.off.2025.down_dist.d3-long.proe",
          "label": "KC offense: pass rate over expected, 3rd & long (2025)",
          "value": 0.1107,
          "display": "11%",
          "unit": "rate",
          "n": 58,
          "low_sample": false,
          "league_value": -0.0117,
          "league_display": "-1%"
        },
        {
          "id": "KC.off.2025.down_dist.d3-long.success_rate",
          "label": "KC offense: success rate, 3rd & long (2025)",
          "value": 0.4828,
          "display": "48%",
          "unit": "rate",
          "n": 58,
          "low_sample": false,
          "league_value": 0.3867,
          "league_display": "39%"
        },
        {
          "id": "KC.off.2025.down_dist.d3-long.pass_success_rate",
          "label": "KC offense: dropback success rate, 3rd & long (2025)",
          "value": 0.5,
          "display": "50%",
          "unit": "rate",
          "n": 58,
          "low_sample": false,
          "league_value": 0.433,
          "league_display": "43%"
        },
        {
          "id": "KC.off.2025.down_dist.d3-long.run_success_rate",
          "label": "KC offense: run success rate, 3rd & long (2025)",
          "value": 0.4286,
          "display": "43%",
          "unit": "rate",
          "n": 58,
          "low_sample": false,
          "league_value": 0.2808,
          "league_display": "28%"
        },
        {
          "id": "KC.off.2025.down_dist.d3-long.epa_per_play",
          "label": "KC offense: EPA/play, 3rd & long (2025)",
          "value": 0.3476,
          "display": "+0.35",
          "unit": "epa",
          "n": 58,
          "low_sample": false,
          "league_value": 0.1241,
          "league_display": "+0.12"
        },
        {
          "id": "KC.off.2025.down_dist.d3-long.explosive_rate",
          "label": "KC offense: explosive-play rate, 3rd & long (2025)",
          "value": 0.0862,
          "display": "9%",
          "unit": "rate",
          "n": 58,
          "low_sample": false,
          "league_value": 0.0855,
          "league_display": "9%"
        },
        {
          "id": "KC.off.2025.down_dist.d3-long.sack_rate",
          "label": "KC offense: sack rate, 3rd & long (2025)",
          "value": 0.0682,
          "display": "7%",
          "unit": "rate",
          "n": 58,
          "low_sample": false,
          "league_value": 0.0696,
          "league_display": "7%"
        },
        {
          "id": "KC.off.2025.down_dist.d3-long.screen_rate",
          "label": "KC offense: screen rate, 3rd & long (2025)",
          "value": 0.1591,
          "display": "16%",
          "unit": "rate",
          "n": 58,
          "low_sample": false,
          "league_value": 0.0854,
          "league_display": "9%"
        },
        {
          "id": "KC.off.2026.zone.opp_territory.pass_rate",
          "label": "KC offense: pass rate, opponent territory",
          "value": 0.6667,
          "display": "67%",
          "unit": "rate",
          "n": 63,
          "low_sample": false,
          "league_value": 0.5891,
          "league_display": "59%"
        },
        {
          "id": "KC.off.2026.zone.opp_territory.success_rate",
          "label": "KC offense: success rate, opponent territory",
          "value": 0.5397,
          "display": "54%",
          "unit": "rate",
          "n": 63,
          "low_sample": false,
          "league_value": 0.4796,
          "league_display": "48%"
        },
        {
          "id": "KC.off.2026.zone.opp_territory.epa_per_play",
          "label": "KC offense: EPA/play, opponent territory",
          "value": -0.0248,
          "display": "-0.02",
          "unit": "epa",
          "n": 63,
          "low_sample": false,
          "league_value": 0.0258,
          "league_display": "+0.03"
        },
        {
          "id": "KC.off.2026.overall.all.epa_per_play",
          "label": "KC offense: EPA/play, all plays",
          "value": 0.3075,
          "display": "+0.31",
          "unit": "epa",
          "n": 192,
          "low_sample": false,
          "league_value": 0,
          "league_display": "0.00"
        },
        {
          "id": "KC.off.2026.overall.all.success_rate",
          "label": "KC offense: success rate, all plays",
          "value": 0.625,
          "display": "63%",
          "unit": "rate",
          "n": 192,
          "low_sample": false,
          "league_value": 0.4564,
          "league_display": "46%"
        },
        {
          "id": "KC.off.2026.overall.all.pass_rate",
          "label": "KC offense: pass rate, all plays",
          "value": 0.6458,
          "display": "65%",
          "unit": "rate",
          "n": 192,
          "low_sample": false,
          "league_value": 0.5899,
          "league_display": "59%"
        },
        {
          "id": "KC.off.2026.overall.all.proe",
          "label": "KC offense: pass rate over expected, all plays",
          "value": 0.1662,
          "display": "17%",
          "unit": "rate",
          "n": 192,
          "low_sample": false,
          "league_value": 0.011,
          "league_display": "1%"
        },
        {
          "id": "KC.off.2026.overall.all.explosive_rate",
          "label": "KC offense: explosive-play rate, all plays",
          "value": 0.1458,
          "display": "15%",
          "unit": "rate",
          "n": 192,
          "low_sample": false,
          "league_value": 0.0967,
          "league_display": "10%"
        },
        {
          "id": "BAL.def.2025.down_dist_zone.d3-long-opp_territory.success_rate",
          "label": "BAL defense: success rate, 3rd & long, opponent territory (2025)",
          "value": 0.35,
          "display": "35%",
          "unit": "rate",
          "n": 20,
          "low_sample": false,
          "league_value": 0.4174,
          "league_display": "42%"
        },
        {
          "id": "BAL.def.2025.down_dist_zone.d3-long-opp_territory.pass_success_rate",
          "label": "BAL defense: dropback success rate, 3rd & long, opponent territory (2025)",
          "value": 0.4615,
          "display": "46%",
          "unit": "rate",
          "n": 20,
          "low_sample": false,
          "league_value": 0.468,
          "league_display": "47%"
        },
        {
          "id": "BAL.def.2025.down_dist_zone.d3-long-opp_territory.run_success_rate",
          "label": "BAL defense: run success rate, 3rd & long, opponent territory (2025)",
          "value": 0.1429,
          "display": "14%",
          "unit": "rate",
          "n": 20,
          "low_sample": false,
          "league_value": 0.2963,
          "league_display": "30%"
        },
        {
          "id": "BAL.def.2025.down_dist_zone.d3-long-opp_territory.epa_per_play",
          "label": "BAL defense: EPA/play, 3rd & long, opponent territory (2025)",
          "value": 0.1146,
          "display": "+0.11",
          "unit": "epa",
          "n": 20,
          "low_sample": false,
          "league_value": 0.2351,
          "league_display": "+0.24"
        },
        {
          "id": "BAL.def.2025.down_dist_zone.d3-long-opp_territory.explosive_rate",
          "label": "BAL defense: explosive-play rate, 3rd & long, opponent territory (2025)",
          "value": 0.1,
          "display": "10%",
          "unit": "rate",
          "n": 20,
          "low_sample": false,
          "league_value": 0.1028,
          "league_display": "10%"
        },
        {
          "id": "BAL.def.2025.down_dist_zone.d3-long-opp_territory.sack_rate",
          "label": "BAL defense: sack rate, 3rd & long, opponent territory (2025)",
          "value": 0.0769,
          "display": "8%",
          "unit": "rate",
          "n": 20,
          "low_sample": false,
          "league_value": 0.0662,
          "league_display": "7%"
        },
        {
          "id": "BAL.def.2025.down_dist_zone.d3-long-opp_territory.blitz_rate",
          "label": "BAL defense: blitz rate, 3rd & long, opponent territory (2025)",
          "value": 0.8462,
          "display": "85%",
          "unit": "rate",
          "n": 20,
          "low_sample": false,
          "league_value": 0.4062,
          "league_display": "41%"
        },
        {
          "id": "BAL.def.2025.down_dist_zone.d3-long-opp_territory.pressure_rate",
          "label": "BAL defense: pressure rate, 3rd & long, opponent territory (2025)",
          "value": 0.4615,
          "display": "46%",
          "unit": "rate",
          "n": 20,
          "low_sample": false,
          "league_value": 0.3576,
          "league_display": "36%"
        },
        {